Person,Category,Quality,Text
A,Greetings,Positive,Good morning! Thank you for calling our bank. My name is John. How may I assist you today?
C,Problem Resolution,Negative,"Hi John, I have a problem with my account. I noticed that I was charged extra fees and I don't know why."
A,Problem Resolution,Positive,"I'm sorry to hear that, sir. May I have your account number to check the details?"
C,Account Verification,Positive,"Sure, it's 123456789."
A,Problem Resolution,Positive,"Thank you for the information. I can see that the fees were charged because of a late payment. However, I can waive the fees for you as a one-time courtesy. Would you like me to do that?"
C,Engagement,Positive,"Oh, that would be great! Thank you so much."
A,Closure,Positive,"You're welcome, sir. I have waived the fees for you. Is there anything else I can assist you with?"
C,Engagement,Negative,"No, that's all. But I'm still not happy with the bank's policies. I think they are unfair."
A,Engagement,Positive,"I understand your frustration, sir. Please know that we always strive to provide the best service and fair policies to our customers. Is there anything else I can help you with?"
C,Engagement,Positive,"No, that's all for now. Thank you for your help, John."
A,Closure,Positive,"You're welcome, sir. It was my pleasure assisting you. Have a great day!"
A,Greetings,Positive,Thank you for calling XYZ bank. How may I assist you today?
C,Problem Resolution,Negative,I have a problem with my credit card bill. It seems too high.
A,Problem Resolution,Positive,I'm sorry to hear that. Can you please provide me with your credit card number so that I can look into it?
C,Account Verification,Positive,"Sure, it is 1234-5678-9012-3456."
A,Problem Resolution,Positive,Thank you for verifying your account. I can see that there was an error in the billing system which caused your bill to be higher than usual. I have now corrected the error and your new bill should reflect the correct amount.
C,Engagement,Positive,Thank you so much for your help. I really appreciate it.
A,Closure,Positive,You're welcome. Is there anything else I can help you with today?
,,,
A,Closure,Positive,You're welcome. Have a great day!
A,Greetings,Positive,Thank you for calling XYZ bank. My name is Alice. How may I assist you today?
C,Problem Resolution,Negative,I have a problem with my account. I made a transfer yesterday but it hasn't reflected yet.
A,Problem Resolution,Positive,I'm sorry to hear that. Can you please provide me with your account number so I can check the status of the transfer?
C,Account Verification,Positive,"Sure, it's 123456789."
A,Problem Resolution,Positive,"Thank you. I can see that the transfer was successful on our end, but it may take a few more hours for it to reflect on your account. Is there anything else I can assist you with?"
,,,
A,Closure,Positive,"You're welcome, have a great day!"
C,Greetings,Positive,"Thank you, you too."
A,Greetings,Positive,Good morning! Thank you for calling XYZ bank. My name is Amanda. How may I assist you today?
C,Problem Resolution,Negative,"Hi Amanda, I have a problem with my account. I checked my balance this morning and it seems like there are unauthorized transactions."
A,Problem Resolution,Positive,I'm sorry to hear that. Let me check your account. May I have your account number or debit card number?
C,Account Verification,Positive,"Sure, it's 123456789."
A,Problem Resolution,Positive,Thank you for verifying your account. I can see here that there were indeed unauthorized transactions. I will now escalate this issue to our fraud department for investigation.
C,Problem Resolution,Negative,This is unacceptable! How could this happen to my account?
A,Engagement,Positive,I completely understand your frustration. Rest assured that we are taking this matter seriously and will do everything we can to resolve this for you.
C,Engagement,Positive,"Thank you for your help, Amanda. I appreciate it."
A,Closure,Positive,"You're welcome, Mr. Smith. We will keep you updated on the progress of the investigation via email or phone. Is there anything else I can help you with today?"
,,,
A,Closure,Positive,"Alright, have a great day ahead!"
A,Greetings,Positive,Thank you for calling Triple-A bank
C,,,"Hi, I have a problem with my account"
A,Problem Resolution,Positive,"Sure, I'll be happy to help. Could you please provide me with your account number?"
C,Account Verification,Positive,My account number is 123456789
A,Problem Resolution,Positive,Thank you. Could you please describe the issue you are having with your account?
C,,,I noticed that I'm being charged an extra fee on my account
A,Problem Resolution,Negative,I'm sorry to hear that. Let me check our records to see what's going on.
A,Problem Resolution,Positive,It appears that the fee is for an overdraft on your account. Did you happen to make a purchase that exceeded your account balance?
C,Problem Resolution,Negative,"No, I don't think so. I always make sure to keep enough funds in my account"
A,Problem Resolution,Positive,I understand. Let me look into this further to see if there has been any mistake. Could you please hold for a moment?
C,,,Sure.
A,Problem Resolution,Positive,"Thank you for waiting. After reviewing your account, it looks like there was a mistake on our end. We will refund the fee to your account within the next 24 hours."
C,Problem Resolution,Positive,Thank you so much for your help!
A,Closure,Positive,You're welcome. Is there anything else I can assist you with today?
C,Engagement,Positive,"No, that was all. You've been very helpful!"
A,Closure,Positive,Thank you for choosing Triple-A bank. Have a great day!
A,Greetings,Positive,Thank you for calling ABC bank. How may I assist you today?
C,Problem Resolution,Negative,I'm having trouble accessing my online account. It keeps saying my password is incorrect.
A,Problem Resolution,Positive,I apologize for the inconvenience. Let me assist you with that. Can you please provide me with your account number?
C,Account Verification,Positive,"Sure, my account number is 123456789."
A,Problem Resolution,Positive,Thank you for that information. Let me verify your account.
A,Problem Resolution,Positive,I can see that your account is locked. I will unlock it for you now.
C,Problem Resolution,Positive,Thank you so much!
A,Engagement,Positive,Is there anything else I can assist you with today?
,,,
A,Closure,Positive,You're welcome. It was my pleasure assisting you today. Have a great day!
A,Greetings,Positive,"Thank you for calling XYZ Bank, this is Sarah. How may I assist you today?"
C,Complaints,Negative,"Yes, hi Sarah. I just received my credit card statement and there are some unauthorized charges on it."
A,Problem Resolution,Positive,I'm sorry to hear that. Can I have your name and credit card number so I can look into this for you?
C,Account Verification,Positive,My name is John Smith and my credit card number is 1234-5678-9012-3456.
A,Problem Resolution,Positive,"Thank you, John. I see the charges you're referring to. I'll need to file a dispute and investigate this further. I'll keep you updated throughout the process."
C,Problem Resolution,Positive,"Okay, thank you."
A,Information Updates,Positive,"In the meantime, I wanted to let you know about our current credit card promotion. If you spend $1000 within the first 3 months of opening a new card, you'll receive a $100 statement credit."
C,Sales,Positive,That sounds like a good deal. Can you tell me more about the benefits of your credit card?
A,Product Support,Positive,"Sure, our credit card offers cash back rewards, no annual fee, and fraud protection. Would you like me to send you the details in an email?"
C,Engagement,Positive,"Yes, please do."
A,Closure,Positive,"I've just sent the email to the address on file. Is there anything else I can assist you with today, John?"
C,Engagement,Positive,"No, that's all for now. Thank you, Sarah."
A,Closure,Positive,"You're welcome, John. Have a great day!"
A,Greetings,Positive,Thank you for calling XYZ Bank. How may I assist you today?
C,Problem Resolution,Negative,"Hi, I have an issue with my recent transaction. The amount deducted from my account is incorrect."
A,Problem Resolution,Positive,I'm sorry to hear that. Can you please provide me with your account number and the details of the transaction?
C,Account Verification,Positive,"Sure, my account number is 123456789 and the transaction date was July 1st."
A,Problem Resolution,Positive,Thank you for the information. Let me check that for you.
A,Problem Resolution,Positive,I see that there was an error in the transaction. We will process a refund of the incorrect amount to your account within 24 hours.
C,Problem Resolution,Positive,Thank you for your assistance. That's great.
A,Engagement,Positive,Is there anything else I can help you with today?
C,Closure,Positive,"No, that's all for now. Thank you."
A,Closure,Positive,You're welcome. Have a great day!
A,Greetings,Positive,"Good afternoon, thank you for calling our customer support line. My name is Sarah, how can I assist you today?"
C,Complaints,Negative,"Hi Sarah, I ordered a product from your website and it arrived damaged. I want to return it and get a refund."
A,Problem Resolution,Positive,I'm sorry to hear that. Can you please provide me with your order number and the reason for the return so I can assist you better?
C,Account Verification,Positive,"Sure, my order number is 1234567 and I'm returning the product because it arrived damaged."
A,Problem Resolution,Positive,Thank you for the information. I have initiated a refund for your order and you should receive the refund within the next 5-7 business days. Is there anything else I can assist you with today?
C,Engagement,Positive,"No, that's all. Thank you for your help, Sarah. You were very helpful."
A,Closure,Positive,"You're welcome, and thank you for choosing our brand. Have a great day!"
A,Greetings,Positive,Good morning! Thank you for calling XYZ Bank. My name is John. How can I assist you today?
C,Product Support,Negative,"Hi John, I have a problem with my debit card. It's not working."
A,Problem Resolution,Positive,I'm sorry to hear that. Can you please provide me with your account number so I can look into it?
C,Account Verification,Positive,"Sure, it's 123456789."
A,Problem Resolution,Positive,Thank you. Let me check... It seems like your card was blocked due to suspicious activity. I'll unblock it for you right away.
C,Problem Resolution,Positive,"Thank you, John. I really appreciate it."
A,Engagement,Positive,You're welcome. Is there anything else I can assist you with?
C,Payment Returns,Negative,"Actually, yes. I made a payment last week but it hasn't been credited to my account yet."
A,Problem Resolution,Positive,I'm sorry about that. Can you please provide me with the payment details so I can investigate?
C,Account Verification,Positive,"Sure, the payment was made on June 30th, for $500, from my checking account."
A,Problem Resolution,Positive,"Thank you. Let me check... I can see that the payment was received, but it hasn't been credited to your account yet. I'll investigate this further and get back to you within 24 hours."
C,Engagement,Positive,"Okay, thank you, John."
A,Information Updates,Positive,"By the way, have you heard about our new credit card promotion? You can earn up to 5% cashback on all purchases."
C,Feedback,Positive,"That sounds really interesting. I'll definitely check it out. Thanks for letting me know, John."
A,Closure,Positive,You're welcome. Is there anything else I can help you with?
,,,
A,Closure,Positive,You're welcome. Thank you for calling XYZ Bank. Have a great day too!
A,Greetings,Positive,Good morning! Thanks for calling our bank. My name is Alex. May I have your name?
,,,
A,Account Verification,Positive,"Thanks, Sarah. To verify your account, can you please provide me with your account number or debit card number?"
C,Account Verification,Positive,"Sure, it is 123456789."
A,Problem Resolution,Negative,"I'm sorry to hear that, Sarah. I see that you have some unauthorized transactions on your account. We need to block your card immediately to prevent any further transactions. Is that okay with you?"
C,Problem Resolution,Negative,"What? Unauthorized transactions? No, that's not okay! Please block my card right away!"
A,Problem Resolution,Positive,"Okay, Sarah. I have blocked your card and filed a dispute for the unauthorized transactions. You will receive a new card within 5 to 7 working days. Is there anything else I can assist you with?"
C,Problem Resolution,Positive,"No, that's all for now. Thank you for your help, Alex."
A,Engagement,Positive,"You're welcome, Sarah. It was my pleasure assisting you. Have a great day!"
,,,
A,Greetings,Positive,"Hello, thank you for calling our bank today. My name is John. How may I assist you?"
C,Complaints,Negative,"Yes, I have a complaint. My credit card statement shows a charge I did not make."
A,Problem Resolution,Positive,"I'm sorry to hear that, ma'am. Can you please provide me with your credit card number so I can check your account?"
C,Account Verification,Positive,"Sure, it's 1234-5678-9012-3456."
A,Problem Resolution,Positive,Thank you. I see the charge you're referring to. I'll dispute it for you and send you an email with the details.
C,Engagement,Positive,"Thank you so much, John. I appreciate your help."
A,Problem Resolution,Positive,You're welcome. Do you have any other concerns I can help you with today?
C,Payment Returns,Negative,"Actually, yes. I returned a product but I haven't received my refund yet."
A,Problem Resolution,Positive,I'm sorry to hear that. Can you please provide me with the order number and the item you returned?
C,Account Verification,Positive,"Yes, the order number is 123456789 and the item was a pair of shoes."
A,Problem Resolution,Positive,Thank you. I see that the refund was processed but it hasn't been credited to your account yet. I'll escalate this to our refunds department and they will contact you within 24-48 hours with an update.
C,Engagement,Positive,"Thank you, John. I appreciate your prompt action."
A,Information Updates,Positive,"You're welcome. By the way, have you heard about our new savings account promotion?"
C,Engagement,Positive,"No, what's that?"
A,Information Updates,Positive,It's a limited-time offer where you can earn 2% interest on your savings account for the first six months. Would you be interested in opening a new account?
C,Engagement,Positive,"Yes, that sounds great. How do I apply?"
A,Account Verification,Positive,"Great! To apply, I just need to verify some information. Can you please provide me with your social security number and your current address?"
C,Account Verification,Positive,"Sure, my social is 111-22-3333 and my address is 123 Main St."
A,Engagement,Positive,Thanks! I'll get that set up for you right away. Is there anything else I can help you with?
C,Feedback,Positive,"No, that's all. I just wanted to say thank you for your excellent service, John. You made my day!"
A,Engagement,Positive,"You're very welcome, ma'am. It was my pleasure helping you today. Have a great day!"
A,Greetings,Positive,"Hello and welcome to XYZ Bank. My name is Alex, how may I assist you today?"
C,Account Verification,Positive,"Hi Alex, I'm calling to verify my account details. My account number is 123456."
A,Problem Resolution,Positive,Thank you for providing your account number. I can see that your account is active and in good standing.
C,Complaints,Negative,"Actually, I have an issue. I was charged a fee for a transaction I didn't make."
A,Problem Resolution,Positive,I apologize for any inconvenience this may have caused. Let me check the details of your account.
C,Problem Resolution,Negative,I've been trying to resolve this issue for weeks now. I hope you can help me.
A,Problem Resolution,Positive,"I understand your frustration, and I will do my best to help you. Can you please provide me with the date and amount of the transaction?"
C,Problem Resolution,Positive,The transaction was made on June 10th for $100.
A,Problem Resolution,Positive,Thank you for the information. I have identified the issue and will process a refund for the unauthorized transaction.
C,Problem Resolution,Positive,"Thank you so much, Alex. I really appreciate your help."
A,Feedback,Positive,I'm glad I could assist you today. Is there anything else I can help you with?
C,Information Update,Positive,"Yes, can you tell me about the latest credit card offer from your bank?"
A,Sales,Positive,"Certainly! Our latest credit card offer provides 0% APR on purchases for the first 12 months, and a 5% cashback reward on all gas and grocery purchases."
C,Engagement,Positive,"That sounds like a great deal. I will definitely consider it. Thank you, Alex!"
A,Closure,Positive,You're welcome. Is there anything else I can help you with today?
,,,
A,Closure,Positive,You're welcome. Thank you for choosing XYZ Bank. Have a great day!
A,Greetings,Positive,Good morning! Thank you for calling our customer service hotline. My name is Sarah. How may I assist you today?
C,Problem Resolution,Negative,"Hi Sarah, I’m calling because I received a damaged product that I purchased online. I want to return it and get a refund."
A,Problem Resolution,Positive,I’m sorry to hear that. We’ll do our best to assist you with that. May I have your order number or tracking number please?
C,Account Verification,Positive,"Sure, it’s 123456789."
A,Problem Resolution,Positive,Thank you for that information. I can see here in our system that the product was delivered to you 5 days ago. Our return policy allows you to return the item within 7 days of receiving it. Have you taken any photos of the damaged product?
C,Problem Resolution,Positive,"Yes, I have some photos of the damaged product."
A,Problem Resolution,Positive,"Great, please send those photos to our email address support@ourcompany.com. Once we receive those photos, we’ll process your refund as soon as possible."
C,Closure,Positive,"Thank you, Sarah. I appreciate your help."
A,Closure,Positive,You’re welcome. Thank you for choosing our company. Have a great day!
C,Feedback,Positive,"By the way, I just want to say that your customer service team is very helpful and accommodating. Keep up the good work!"
A,Engagement,Positive,Thank you for that kind feedback. We really appreciate it. Is there anything else I can help you with today?
C,Information Update,Positive,"No, that’s all for now. But before I go, can you give me an update on the status of my refund?"
A,Problem Resolution,Positive,"Sure, let me check that for you. I can see here that we’ve already received your email with the photos of the damaged product. Our refund team is currently processing your request and you should receive your refund within the next 3-5 business days. Is there anything else I can help you with?"
C,Closure,Positive,"No, that’s all. Thank you again for your help, Sarah. Have a great day!"
A,Closure,Positive,You’re welcome. Thank you for calling our customer service hotline. Have a great day too!
A,Greetings,Positive,"Thank you for calling Bank of Solutions, my name is John. How can I assist you today?"
,,,
A,Problem Resolution,Positive,"I understand the situation, can you please provide me your account details so I can verify your identity?"
C,Account Verification,Positive,"Sure, my account number is 123456789."
A,Problem Resolution,Positive,"Thank you for verifying your account. I can see the transaction in question. Unfortunately, we cannot cancel the transfer once it has been processed. However, I can assist you in filing a dispute resolution request with the recipient bank. Would you like me to do that for you?"
C,Problem Resolution,Positive,"Yes, please. That would be great."
A,Problem Resolution,Positive,"Alright, I have submitted the dispute resolution request. You will be notified via email once the issue has been resolved. Is there anything else I can assist you with?"
C,Payment Returns,Negative,"Actually, yes. I received a product that is defective and I want to return it for a refund."
A,Problem Resolution,Positive,I apologize for the inconvenience. Can you please provide me the details of the product and the purchase?
C,Problem Resolution,Positive,"Sure, I bought a laptop from your website two weeks ago. The order number is 987654321."
A,Problem Resolution,Positive,Thank you for providing the details. I can see the order in question and I will start the return process. You will receive a return label via email shortly. Is there anything else I can assist you with?
C,Feedback,Positive,"No, that's all. Thank you for your help, John. You've been very professional and efficient."
A,Engagement,Positive,"I'm glad I could assist you, it's always a pleasure to help our customers. Do you have any other feedback or suggestions for us?"
C,Feedback,Positive,"Actually, yes. I recently used your mobile app and it was very user-friendly and intuitive. I had no issues with it."
A,Feedback,Positive,"Thank you for your feedback, we are constantly working to improve our services and it's great to hear positive feedback from our customers. Is there anything else I can assist you with?"
C,Closure,Positive,"No, that's all for now. Thank you again, John."
A,Closure,Positive,"You're welcome, have a great day!"
A,Greetings,Positive,Good morning! Thank you for calling ABC Bank. How may I assist you today?
C,Product Support,Negative,I need help with my online banking. It's not letting me log in.
A,Problem Resolution,Positive,I'm sorry to hear that. Let me look into that for you. Can I please have your account number?
C,Account Verification,Positive,"Sure, it's 123456789."
A,Problem Resolution,Positive,Thank you. I see that your account is locked. I will unlock it for you now. Please try logging in again.
C,Product Support,Positive,"Great, thank you!"
A,Engagement,Positive,Is there anything else I can help you with today?
C,Feedback,Positive,"Actually, yes. I wanted to give some feedback on the mobile app. It's a bit confusing to use."
A,Feedback,Positive,Thank you for your feedback. We are always looking for ways to improve our services. Can you please tell me more about what you found confusing?
C,Feedback,Negative,"Well, for example, I couldn't find the option to transfer money between accounts."
A,Feedback,Positive,I understand. We will definitely take that into consideration for future updates. Thank you for letting us know.
C,Payment Returns,Negative,"Actually, there is one more thing. I made a payment that was supposed to go to my credit card, but it was applied to my mortgage by mistake."
A,Problem Resolution,Positive,I'm sorry for the inconvenience. Let me check on that for you. Can you please give me the payment reference number?
C,Payment Returns,Positive,"Sure, it's 987654321."
A,Problem Resolution,Positive,Thank you. I have located the payment and will process a refund to your credit card. You should see it reflected in your account within 3-5 business days.
C,Payment Returns,Positive,Thank you so much!
A,Closure,Positive,You're welcome. Is there anything else I can help you with today?
C,Closure,Positive,"No, that's everything. Thank you for your help!"
A,Closure,Positive,It was my pleasure. Have a great day!
A,Greetings,Positive,Thank you for calling XYZ Bank. My name is John. How may I assist you today?
C,Complaints,Negative,"Yes, I'm calling because I have a complaint about a charge on my account."
A,Problem Resolution,Positive,I'm sorry to hear that. Can you please provide me your account number so I can check the details?
C,Account Verification,Positive,"Sure, it is 123456789."
A,Problem Resolution,Positive,Thank you. I can see that there is a charge of $50 for a transaction at a restaurant. Can you confirm if you made this transaction?
C,Complaints,Negative,"No, I did not make that transaction. I don't even live in that city."
A,Problem Resolution,Positive,"I see. In that case, I will raise a dispute for this transaction and the amount will be refunded to your account within 7-10 business days."
C,Problem Resolution,Positive,Thank you. That's all I needed.
A,Closure,Positive,You're welcome. Is there anything else I can assist you with today?
,,,
A,Engagement,Positive,It was my pleasure to assist you. Have a great day!
,,,
A,Greetings,Positive,"Thank you for calling our company, how may I assist you today?"
C,Problem Resolution,Negative,"I have an issue with the product I purchased, it broke after only a few uses."
A,Problem Resolution,Positive,I'm sorry to hear that. Can you please provide me with your order number and details on the issue you're experiencing?
,,,
A,Problem Resolution,Positive,Thank you. I've located your order and I can see that it's still under warranty. I'll submit a request for a replacement product to be sent to you.
C,Problem Resolution,Positive,"Thank you, I appreciate that."
A,Engagement,Positive,You're welcome! Is there anything else I can help you with today?
C,Sales,Positive,"Actually, I was also interested in purchasing another product. Can you tell me more about it?"
A,Information Updates,Positive,Of course! Our new product is a high-quality speaker that delivers exceptional sound. It's available in three colors and comes with a one-year warranty. Would you like to place an order now?
,,,
A,Information Updates,Positive,"Absolutely. The speaker has Bluetooth connectivity, a built-in microphone, and a rechargeable battery that lasts up to 10 hours. The price is $150 with free shipping. Would you like to proceed with the purchase?"
C,Sales,Positive,"Yes, I'll take one in blue. How do I complete the purchase?"
