Person,Category,Quality,Text
A,Closure,Positive,"You're welcome, Mr. Smith. It was my pleasure to assist you today. Have a great day!"
C,Closure,Positive,"You too, Alice. Thanks again!"
A,Greetings,Positive,Thank you for calling XYZ bank. How may I assist you today?
C,Complaints,Negative,I have an issue with a recent transaction on my account.
A,Problem Resolution,Positive,I'm sorry to hear that. Can you please provide me with your account number so I can look into this for you?
C,Account Verification,Positive,"Sure, my account number is 123456789."
A,Problem Resolution,Positive,Thank you. I can see the transaction in question. Can you please provide me with more details about the issue?
C,Complaints,Negative,"Yes, I did not authorize this transaction and it's causing my account to overdraft."
A,Problem Resolution,Positive,I apologize for the inconvenience. I will file a dispute on your behalf and the funds should be returned to your account within 7-10 business days.
C,Feedback,Positive,"Thank you, I appreciate your help in resolving this issue."
A,Closure,Positive,You're welcome. Is there anything else I can assist you with today?
,,,
A,Closure,Positive,It was my pleasure. Thank you for choosing XYZ bank. Have a great day!
A,Greetings,Positive,"Hello! Thank you for calling our bank. My name is Sarah. May I have your name, please?"
,,,
A,Account Verification,Positive,"Great, John. To verify your account, can you please provide me with your account number or debit card number?"
,,,
A,Product Support,Positive,"Thank you, John. How may I assist you today?"
C,Complaints,Negative,I have an issue with a transaction on my account. It looks like I was charged twice for the same purchase.
A,Problem Resolution,Positive,"I'm sorry to hear that, John. Let me take a look at your account and see what we can do to resolve this issue."
A,Problem Resolution,Positive,"Alright, I have found the transaction in question. It appears to be a duplicate charge. I will go ahead and process a refund for you."
C,Feedback,Positive,"Thank you so much for your help, Sarah. I really appreciate it."
A,Engagement,Positive,"You're welcome, John. It was my pleasure to assist you."
,,,
A,Closure,Positive,"Goodbye, John. Have a great day!"
A,Greetings,Positive,Thank you for calling ABC Bank. How may I assist you today?
C,Problem Resolution,Negative,I have a problem with my recent transaction. There was an unauthorized charge on my account.
A,Problem Resolution,Positive,I'm sorry to hear that. Can you please provide me with your account number and some information about the transaction?
C,Account Verification,Positive,"Sure, my account number is 123456789 and the transaction was for $100 at a gas station."
A,Problem Resolution,Positive,Thank you for the information. I will look into this and get back to you as soon as possible about the status of your dispute.
C,Engagement,Positive,"Thank you, I appreciate your help."
A,Information Update,Positive,"In the meantime, I want to let you know that we have a new credit card promotion going on right now. Would you be interested in learning more about it?"
,,,
A,Problem Resolution,Positive,"Of course, I understand. I will prioritize your dispute and get back to you as soon as I have an update."
C,Closure,Positive,Thank you for your help. I appreciate it.
A,Closure,Positive,You're welcome. Thank you for choosing ABC Bank. Have a great day!
A,Greetings,Positive,"Thank you for calling our bank, how can I assist you today?"
C,Account Verification,Positive,"Yes, I need to verify my account. My account number is 123456789."
A,Problem Resolution,Positive,Thank you for verifying your account. How can I assist you further?
C,Complaints,Negative,I received a charge on my account that I didn't authorize.
A,Problem Resolution,Positive,I'm sorry to hear that. Can you please provide me with more information so I can investigate this for you?
C,Problem Resolution,Negative,I've already called several times and no one has been able to help me.
A,Engagement,Positive,"I understand your frustration, and I want to help you resolve this issue. Can you please provide me with your account details and the specific transaction you are referring to?"
C,Problem Resolution,Negative,"I can't believe this is happening, I've never had a problem like this with any other bank."
A,Engagement,Positive,I'm sorry for the inconvenience. Rest assured that we will do our best to resolve this issue for you as soon as possible.
C,Closure,Positive,Thank you for your help. I appreciate it.
A,Closure,Positive,You're welcome. Have a great day!
A,Greetings,Positive,"Thank you for calling our bank. My name is Alex, how can I assist you today?"
C,Account Verification,Positive,"Hi Alex, I need to verify my account to make a payment."
A,Account Verification,Positive,"Sure, can you please provide me with your account number or debit card number to verify your identity?"
C,Account Verification,Positive,"Yes, my account number is 123456789."
A,Problem Resolution,Positive,Thank you for verifying your account. How can I assist you with your payment?
C,Problem Resolution,Negative,I made a payment but it didn’t go through. What’s going on?
A,Problem Resolution,Positive,I'm sorry to hear that. Can you please provide me with the payment details so we can investigate this further?
C,Problem Resolution,Negative,I don’t have the details with me right now. Can you just cancel the payment and refund me?
A,Problem Resolution,Positive,"I understand your frustration. As soon as you have the payment details, please give us a call back so we can assist you with the refund process. Is there anything else I can help you with today?"
C,Engagement,Positive,"No, thank you for your help. You've been very patient and understanding."
A,Closure,Positive,You're welcome. Thank you for calling our bank. Have a great day!
A,Greetings,Positive,"Hello, thank you for calling XYZ Bank. My name is Alex, how may I assist you today?"
C,Complaints,Negative,I am having trouble accessing my online banking account. This is very frustrating!
A,Problem Resolution,Positive,I'm sorry to hear that. Could you please provide me with your account number or debit card number so I can investigate this issue for you?
C,Account Verification,Positive,"Sure, my account number is 123456789."
A,Problem Resolution,Positive,Thank you for verifying your account. I have checked and it appears that there may be an issue with your account settings. Let me see if I can resolve this for you.
A,Problem Resolution,Positive,"Okay, I have made the necessary changes to your account settings. Can you please try logging in again and let me know if you are still experiencing issues?"
C,Problem Resolution,Positive,"Thank you, it looks like the issue has been resolved. I appreciate your help."
A,Engagement,Positive,You're welcome! Is there anything else I can assist you with today?
C,Payment Returns,Negative,"Actually, I have a question about a recent purchase I made. I received a defective product and want to return it for a refund."
A,Problem Resolution,Positive,I'm sorry to hear that. Can you please provide me with your order number or purchase information so I can look into this for you?
C,Account Verification,Positive,"Sure, my order number is 987654321."
A,Problem Resolution,Positive,Thank you for verifying your purchase. I have checked and it appears that we can process a return for you. Can you please provide me with your shipping information so we can send you a return label?
C,Information Updates,Positive,"Yes, my shipping address is 123 Main Street, Anytown, USA."
A,Problem Resolution,Positive,Thank you for providing your shipping information. We will send you a return label via email within the next 24 hours. Is there anything else I can assist you with today?
C,Feedback,Positive,"No, that's all. Thank you for your help. You've been very patient and helpful."
A,Closure,Positive,"You're welcome, and thank you for choosing XYZ Bank. Have a great day!"
A,Greetings,Positive,Good morning! Thank you for calling our bank. How can I assist you today?
C,Problem Resolution,Negative,I need to dispute a charge on my account. It was not authorized.
A,Problem Resolution,Positive,I'm sorry to hear that. Let me check that for you. Can you please provide me with the date and amount of the charge?
C,Problem Resolution,Negative,It was on June 15th for $250.
A,Problem Resolution,Positive,Thank you. I see the charge here. Let me file a dispute for you and we will investigate the issue. You should see the funds returned to your account within 10 business days.
C,Problem Resolution,Positive,Thank you so much. I really appreciate your help.
A,Closure,Positive,You're welcome. Is there anything else I can assist you with today?
,,,
A,Closure,Positive,You're welcome. Have a great day!
A,Greetings,Positive,Good morning! Thank you for calling XYZ Bank. My name is John. How may I assist you today?
C,Problem Resolution,Negative,"Hi John, I have an issue with my credit card bill. I was charged twice for the same transaction."
A,Problem Resolution,Positive,"I'm sorry to hear that, let me check your account. Can you please provide me with your credit card number?"
C,Account Verification,Positive,"Sure, it's 1234-5678-9012-3456."
A,Problem Resolution,Positive,Thank you. I can see the double charge on your account. I will initiate a refund and you should receive it within 5-7 business days. Is there anything else I can help you with?
C,Engagement,Positive,"No, that's all. Thank you so much for your help!"
A,Closure,Positive,You're welcome! It was my pleasure to assist you. Have a great day!
C,Feedback,Positive,I just wanted to say that your customer service is excellent. Thank you again!
A,Engagement,Positive,Thank you for your kind words. We strive to provide the best service possible. Is there anything else I can help you with?
,,,
A,Closure,Positive,You too! Thank you for choosing XYZ Bank.
A,Greetings,Positive,"Thank you for calling our bank, how can I assist you today?"
,,,
A,Greetings,Positive,"Of course, I'd be happy to help you with that. May I have your account number please?"
C,Account Verification,Positive,"Yes, my account number is 123456."
,,,
C,Problem Resolution,Negative,I noticed that there's a charge on my account that I didn't authorize.
A,Problem Resolution,Positive,I'm sorry to hear that. Let me pull up your account and take a look.
,,,
C,Engagement,Negative,"No, I don't want to cancel it. I just don't remember signing up for it."
A,Engagement,Positive,I understand. Sometimes these things can slip our mind. I can cancel the subscription for you now if you'd like?
,,,
A,Problem Resolution,Positive,"I'm sorry for the confusion. We'll definitely take a look into why the notification wasn't sent and see how we can improve our customer service. As for the charge, I'll go ahead and issue a refund for you."
,,,
A,Closure,Positive,It should take about 3-5 business days. Is there anything else I can assist you with today?
,,,
A,Closure,Positive,You're welcome. Have a great day!
A,Greetings,Positive,"Good morning, thank you for calling XYZ Bank. My name is Jane, how may I assist you today?"
C,Payment Returns,Negative,"Hi, I recently returned a product that I purchased using my credit card, but I still haven't received the refund. Can you help me with that?"
A,Problem Resolution,Positive,"I'm sorry to hear that, sir. Can you please provide me with your credit card number so I can check on the status of the refund?"
C,Account Verification,Positive,"Sure, it's 1234-5678-9012-3456."
A,Problem Resolution,Positive,"Thank you, sir. I can see that the refund was processed and should be credited to your account within 2-3 business days. Is there anything else I can help you with?"
,,,
A,Closure,Positive,"You're welcome, sir. Have a great day!"
A,Greetings,Positive,"Good afternoon, welcome to XYZ Bank. This is Jane, how may I assist you?"
C,Product Support,Negative,"Hi, I have a question about one of your products. I bought a laptop from your store, but it's not working properly."
A,Problem Resolution,Positive,"I'm sorry to hear that, sir. Can you please provide me with the details of the issue you're facing with the laptop?"
C,Problem Resolution,Negative,The laptop keeps shutting down randomly and I can't get any work done. I'm very frustrated with this product.
A,Problem Resolution,Positive,"I understand your frustration, sir. Let me check if we have any known issues with this particular model. Can you please provide me with the serial number of the laptop?"
C,Account Verification,Positive,"Yes, it's 7890-1234-5678-9012."
A,Problem Resolution,Positive,"Thank you, sir. I can see that there have been some reported issues with this model. I will initiate a replacement for you and you should receive the new laptop within 3-5 business days. Is there anything else I can help you with?"
,,,
A,Closure,Positive,"You're welcome, sir. I apologize for the inconvenience caused. Have a great day!"
A,Greetings,Positive,"Good evening, thank you for calling XYZ Bank. My name is Jane, how may I assist you?"
C,Feedback,Positive,"Hi, I just wanted to say that I'm really happy with the customer service I received from you guys. Your representatives are always so helpful and courteous."
A,Engagement,Positive,"Thank you so much for your kind words, sir.We really appreciate your feedback and we're glad to hear that you had a positive experience with us. Is there anything else I can help you with?"
,,,
A,Closure,Positive,"Thank you for taking the time to provide us with your feedback, sir. We always strive to provide the best possible service to our customers. Have a great day!"
A,Greetings,Positive,Good morning! Thank you for calling XYZ Bank. My name is John. How can I assist you today?
C,Payment Returns,Negative,"Hi John, I received a product from your bank that was damaged during shipping. I want to return it and get a refund."
A,Problem Resolution,Positive,I'm sorry to hear that. Can you please provide me with your order number and the reason for the return?
C,Account Verification,Positive,"Sure, my order number is 123456 and my account number is 7890123."
A,Problem Resolution,Positive,Thank you. I have located your account and verified your information. We will process your return and refund within 3-5 business days.
,,,
A,Closure,Positive,"No, that's it. Thank you for contacting us. Have a great day!"
C,Feedback,Positive,"Thank you, John. You were very helpful and resolved my issue quickly. I appreciate it."
A,Engagement,Positive,You're welcome! It was my pleasure to assist you. Is there anything else I can help you with today?
C,Sales,Positive,"Actually, yes. I'm interested in opening a new account. Can you provide me with some information about your savings accounts?"
A,Information Update,Positive,"Of course! We have several savings account options. Our most popular one is the High Yield Savings account, which offers a competitive interest rate and no monthly mainteunkce fees. Would you like me to send you more information about it?"
C,Engagement,Positive,"Yes, please. That would be great."
A,Closure,Positive,"Sure, I'll send it to your email address on file. Is there anything else I can help you with today?"
,,,
A,Closure,Positive,You're welcome! Thank you for considering XYZ Bank. Have a great day!
A,Greetings,Positive,Thank you for calling our bank. My name is John. How may I assist you today?
C,Sales,Positive,"Hi John, I'm interested in opening a new checking account. Can you tell me about your options?"
A,Information Update,Positive,Of course! We offer a range of checking accounts to fit your needs. Our most popular option is the Advantage Checking account which has no monthly fees and earns interest. Would you like me to send you more information?
C,Problem Resolution,Negative,"Actually, I have an issue with my current account. I was charged an overdraft fee but I don't understand why. Can you explain?"
A,Problem Resolution,Positive,I'm sorry to hear that. Let me take a look at your account. Can you provide me with your account number?
C,Account Verification,Positive,"Sure, it's 12345678."
A,Problem Resolution,Positive,I see that the overdraft fee was charged because you made a purchase that exceeded your available balance. Would you like me to go over some tips to help you avoid overdraft fees in the future?
C,Engagement,Positive,"Yes, please. That would be helpful."
A,Problem Resolution,Positive,Great! One tip is to sign up for our overdraft protection service which can help prevent fees in case of an overdraft. Another tip is to keep track of your balance and set up alerts for low balances. Would you like me to enroll you in our overdraft protection service?
C,Engagement,Positive,"Yes, please do that. Thank you!"
A,Problem Resolution,Positive,You're welcome! I have enrolled you in our overdraft protection service and you should receive an email confirmation shortly. Is there anything else I can help you with?
C,Feedback,Positive,"No, that's all. Thank you for your help. You were very informative and patient."
A,Closure,Positive,Thank you for your kind words. It was my pleasure to assist you. Have a great day!
C,Closure,Positive,You too! Goodbye.
A,Greetings,Positive,"Good morning, thank you for calling XYZ Bank. How can I assist you today?"
C,Problem Resolution,Negative,"Hi, I'm calling because I received a charge on my account that I didn't authorize."
A,Problem Resolution,Positive,I'm sorry to hear that. Can you please provide me with your account number so I can look into this for you?
C,Account Verification,Positive,"Sure, it's 123456789."
A,Problem Resolution,Positive,Thank you. I can see that there was a charge for a subscription service. Did you sign up for this service?
C,Problem Resolution,Negative,"No, I didn't sign up for that service."
A,Problem Resolution,Positive,I understand. I will initiate a refund for that charge and also block any future charges from that subscription service.
C,Problem Resolution,Positive,Thank you so much!
A,Closure,Positive,You're welcome. Is there anything else I can assist you with today?
C,Engagement,Positive,"No, that's all. I just wanted to say thank you for your help."
A,Engagement,Positive,It was my pleasure. Have a great day!
A,Greetings,Positive,Thank you for calling XYZ Bank. How may I assist you today?
C,Problem Resolution,Negative,I have an issue with my recent transaction. I was charged twice for the same purchase.
A,Problem Resolution,Positive,I'm sorry to hear that. May I have your account number so I can look into it?
C,Account Verification,Positive,"Sure, my account number is 123456789."
A,Problem Resolution,Positive,Thank you for verifying your account. I can confirm that there was an error in the transaction. I will process a refund for the extra amount.
C,Problem Resolution,Positive,Thank you so much for your help. I appreciate it.
A,Engagement,Positive,You're welcome! Is there anything else I can help you with today?
,,,
A,Closure,Positive,You're welcome. Have a great day!
A,Greetings,Positive,Thank you for calling ABC Bank. How may I assist you today?
C,Sales,Positive,I want to know more about the credit cards you offer.
A,Information Update,Positive,Certainly! We have a range of credit cards with different benefits and rewards. Can I have your name and account number to check your eligibility?
C,Account Verification,Positive,"Sure, my name is John Doe and my account number is 123456."
A,Problem Resolution,Positive,"Thank you, John. Based on your account history, you are eligible for our Platinum credit card. Would you like to apply for it now or would you like to know more about the features?"
C,Engagement,Positive,I would like to know more about the features.
A,Information Update,Positive,"Sure, the Platinum card offers cashback rewards on all purchases, travel insurance, and a low interest rate. Does that sound good to you?"
C,Feedback,Positive,"Yes, that sounds great! Thanks for your help."
A,Closure,Positive,"Glad to hear that, John. Is there anything else I can assist you with today?"
,,,
A,Greetings,Positive,"Hello, thank you for calling XYZ Bank. My name is Alex, how can I assist you today?"
C,Problem Resolution,Negative,"Hi Alex, I have an issue with my account. I made a payment yesterday and it's still not showing up."
A,Problem Resolution,Positive,I'm sorry to hear that. Can you please provide me with your account number so I can take a look?
C,Account Verification,Positive,"Sure, it's 123456789."
A,Problem Resolution,Positive,"Thank you, let me check. Yes, I see the payment here. It looks like there was just a delay in processing. Is there anything else I can help you with?"
C,Problem Resolution,Positive,"No, that's all. Thank you, Alex."
A,Closure,Positive,You're welcome. Have a great day!
C,Greetings,Positive,"Hi, I have a question about your credit cards."
A,Engagement,Positive,"Of course, I'd be happy to help. What would you like to know?"
C,Problem Resolution,Negative,"I'm trying to apply for a credit card online, but the application keeps getting rejected."
A,Problem Resolution,Positive,I'm sorry to hear that. Can you please provide me with some more information about the error message you're seeing?
C,Problem Resolution,Negative,"It just says ""application rejected"". That's all."
A,Problem Resolution,Positive,"Okay, let me check. It looks like there was an issue with your credit score. Would you like me to connect you with our credit department to discuss your options?"
C,Engagement,Positive,"Yes, that would be great. Thank you, Alex."
A,Closure,Positive,You're welcome. I'm connecting you now.
C,Feedback,Positive,"I just wanted to say that your customer service is excellent. Thank you for your help, Alex."
A,Engagement,Positive,Thank you so much for the kind words. It was my pleasure to assist you. Is there anything else you need help with?
C,Closure,Positive,"No, that's all. Have a great day!"
A,Closure,Positive,You too! Thank you for banking with XYZ Bank.
A,Greetings,Positive,"Good morning and thank you for calling our bank, how may I assist you today?"
C,Complaints,Negative,"Hi, I have an issue with my recent transaction. I was charged twice for the same amount."
A,Problem Resolution,Positive,"I apologize for the inconvenience, let me check that for you. Can you please provide me with your account number?"
C,Account Verification,Positive,"Sure, it is 123456789."
A,Problem Resolution,Positive,Thank you. I can see the double charge on your account. I will process the refund for you and it should reflect in your account within 5-7 business days.
C,Engagement,Positive,Thank you for your help. I appreciate it.
A,Closure,Positive,You're welcome. Is there anything else I can assist you with today?
,,,
A,Engagement,Positive,You're welcome. Have a great day!
,,,
A,Greetings,Positive,"Welcome to our bank, how may I assist you today?"
,,,
A,Problem Resolution,Positive,"I see, can you please provide me your account number so I can check on your account?"
C,Account Verification,Positive,"Sure, it is 123456789."
A,Problem Resolution,Positive,Thank you. I can see that you have an outstanding balance on your credit card. Would you like to make a payment today?
,,,
A,Problem Resolution,Negative,"I understand, but please be aware that your account may incur additional fees and interest if the balance is not paid in full."
,,,
A,Problem Resolution,Positive,I will check if that's possible. Can you please hold for a moment?
C,Engagement,Positive,"Sure, I'll wait."
A,Problem Resolution,Positive,"Thank you for waiting. I have good news, we can waive the fees and interest charges on your account. Is there anything else I can assist you with today?"
,,,
A,Closure,Positive,You are welcome. Have a great day!
,,,
A,Greetings,Positive,"Good morning! Thank you for calling XYZ Bank, my name is John. How may I assist you today?"
C,Problem Resolution,Negative,"Hi John, I'm having trouble accessing my online banking. It keeps saying ""invalid login"". Can you help me with this?"
A,Problem Resolution,Positive,I'm sorry to hear that. Let me check your account. May I have your account number please?
C,Account Verification,Positive,"Sure, it's 123456789"
A,Problem Resolution,Positive,Thank you. I see that your account is temporarily locked. I will reset your password and send you a link to create a new one. Is that okay?
C,Problem Resolution,Positive,"Yes, please do that. Thank you!"
A,Problem Resolution,Positive,You're welcome! I just sent the link to your registered email address. Please check your inbox and let me know if you need further assistance.
C,Problem Resolution,Positive,"Got it, thank you!"
A,Feedback,Positive,Is there anything else I can help you with today?
C,Feedback,Negative,"Actually, I'm not happy with the interest rate on my savings account. It's too low compared to other banks."
A,Problem Resolution,Positive,I understand your concern. Let me check if we have any promotions or better options for your account. May I place you on hold for a moment?
C,Engagement,Positive,"Sure, take your time."
A,Information Update,Positive,Thank you for waiting. I have good news! We have a new savings account promotion that offers a higher interest rate. Would you like me to transfer you to our sales team to discuss the details?
C,Engagement,Positive,"Yes, please do that! Thank you for your help."
A,Closure,Positive,You're welcome! I'll transfer you now. Have a great day!
B,Sales,Positive,"Hello, this is Jane from the sales team. How may I assist you today?"
C,Sales,Positive,"Hi Jane, I'm interested in the new savings account promotion that offers a higher interest rate. Can you tell me more about it?"
