Person,Category,Quality,Text
A,Information Update,Positive,I've checked and it looks like your refund was processed yesterday. You should see the funds in your account within the next 2-3 business days.
C,Closure,Positive,That's great news! Thank you for your help with that. I'm excited to open my new Elite account with you. Can you walk me through the next steps?
A,Engagement,Positive,Absolutely! Let's get started with the application process. I'll need to ask you a few more questions to get everything set up for you.
C,Closure,Positive,"Thank you, Alex. You've been incredibly helpful today. I appreciate your time and attention to my needs."
A,Closure,Positive,My pleasure! Thank you for choosing XYZ Bank. Have a great day!
A,Greetings,Positive,"Thank you for calling XYZ Bank, my name is Sarah. How may I assist you today?"
C,Product Support,Negative,I'm having trouble accessing my online banking.
A,Problem Resolution,Positive,"I apologize for the inconvenience, may I please have your account number so I can look into this for you?"
C,Account Verification,Positive,"Sure, it is 123456789."
A,Problem Resolution,Positive,"Thank you, I can see that there was a temporary issue with our website which may have caused the problem. However, it has been resolved now and you should be able to access your account without any issues. Is there anything else I can help you with?"
C,Payment Returns,Negative,"Yes, actually. I made a purchase and the item I received was damaged. I need to return it and get a refund."
A,Problem Resolution,Positive,I apologize for the inconvenience. May I please have the order number and the reason for return?
C,Account Verification,Positive,The order number is 987654 and the reason for return is that the item was damaged during shipping.
A,Problem Resolution,Positive,"Thank you, I have processed the return and you will receive a refund within 7-10 business days. Is there anything else I can assist you with?"
C,Feedback,Positive,"No, that's all. Thank you for your help, Sarah. You were very patient and helpful."
A,Engagement,Positive,You are very welcome! I'm glad I could assist you today. Thank you for choosing XYZ Bank.
A,Greetings,Positive,Good morning! Thank you for calling our bank. My name is Alex. How may I assist you today?
C,Problem Resolution,Negative,"Hi Alex, I have an issue with my credit card bill. There are some charges that I don't recognize."
A,Problem Resolution,Positive,I see. Let me check your account. Can you please verify your identity by providing your account number and date of birth?
C,Account Verification,Positive,"Sure, my account number is 123456789 and my date of birth is January 1, 1990."
A,Problem Resolution,Positive,Thank you. I have checked your account and it seems that those charges are from a subscription service that you signed up for. Do you want me to cancel the subscription for you?
C,Problem Resolution,Negative,"No, I don't want to cancel the subscription. I want a refund for those charges."
A,Problem Resolution,Positive,I understand. Let me check if you are eligible for a refund. Can you please hold for a few minutes?
C,Engagement,Positive,"Sure, take your time."
A,Problem Resolution,Positive,Thank you for waiting. I have checked and confirmed that you are eligible for a refund. The amount will be credited to your account within 3-5 business days.
C,Problem Resolution,Positive,"Thank you so much for your help, Alex. You have been very helpful."
A,Closure,Positive,You are welcome. It was my pleasure assisting you. Is there anything else that I can help you with today?
,,,
A,Closure,Positive,You are welcome. Have a great day!
A,Greetings,Positive,"Good morning! Thank you for calling our bank, my name is Sarah. How may I assist you today?"
C,Complaints,Negative,"Hi Sarah, I've been having trouble with my account. I keep getting charged fees that I don't understand."
A,Problem Resolution,Positive,I'm sorry to hear that. Let me take a look at your account and see what I can do.
A,Account Verification,Positive,Can you please verify your account number for me?
C,Account Verification,Positive,"Sure, it's 123456789."
A,Problem Resolution,Positive,"Thank you. I can see that the fees were due to a missed payment. However, I can waive the fees for you this time."
C,Problem Resolution,Positive,"Thank you, Sarah. I really appreciate your help."
A,Engagement,Positive,You're welcome! Is there anything else I can help you with today?
C,Sales,Positive,"Actually, I'm interested in opening a new account. Can you tell me more about your savings account options?"
A,Information Updates,Positive,Of course! We have a few different options with different interest rates and minimum balance requirements. Let me pull up some information for you.
A,Information Updates,Positive,Our most popular option is the High-Yield savings account. It has a 1.5% interest rate and a minimum balance requirement of $500.
C,Sales,Positive,"That sounds great. Can I open an account online, or do I need to come into a branch?"
A,Problem Resolution,Positive,"You can actually open an account online! Just go to our website and follow the prompts. If you have any trouble, feel free to give us a call back."
C,Engagement,Positive,"Thanks, Sarah! I appreciate your help. You've been very informative."
A,Closure,Positive,You're welcome! It was my pleasure to assist you. Have a great day!
C,Feedback,Positive,You too! I just wanted to let you know that your customer service is excellent.
A,Feedback,Positive,Thank you so much! That means a lot to us. Have a great day!
A,Greetings,Positive,Good morning! Thank you for calling our bank. How can I assist you today?
C,Account Verification,Positive,"Hi, I need to verify my account. My account number is 1234567."
A,Problem Resolution,Positive,"Certainly, let me pull up your account. I see that your account is in good standing. Is there anything else I can help you with?"
C,Payment Returns,Negative,"Actually, yes. I recently made a purchase and the item was defective. I'd like to return it and get a refund."
A,Problem Resolution,Positive,I'm sorry to hear that. Let me look into your purchase history and see what we can do. Can you please provide me with the order number and the date of purchase?
C,Problem Resolution,Positive,"Sure, the order number is 9876543 and I made the purchase on June 23rd."
A,Problem Resolution,Positive,Thank you. I see that you are eligible for a refund. We will process that for you right away. You should receive the refund within 5-7 business days. Is there anything else I can help you with?
C,Feedback,Positive,"No, that's all. Thank you for your help. I appreciate your quick and efficient service."
A,Engagement,Positive,You're welcome! Thank you for the kind words. Is there anything else I can assist you with today?
,,,
A,Closure,Positive,You're very welcome. Have a great day!
A,Greetings,Positive,Thank you for calling XYZ Bank. My name is Sarah. How may I assist you today?
C,Complaints,Negative,I'm having trouble accessing my online banking account. It keeps saying my password is incorrect.
A,Problem Resolution,Positive,I'm sorry to hear that. Let me verify some details first. May I have your account number please?
C,Account Verification,Positive,"Sure, it's 123456789."
A,Problem Resolution,Positive,Thank you. I can see here that your account is temporarily locked. I'll send a password reset link to your registered email address.
,,,
A,Problem Resolution,Positive,You're welcome. Is there anything else I can help you with?
C,Sales,Positive,"Actually, I'm interested in opening a new savings account. What are the current interest rates?"
A,Information Update,Positive,Our current interest rate for savings accounts is 1.5%. Would you like me to help you open an account today?
C,Engagement,Positive,"Yes, please."
A,Account Verification,Positive,"Great! To open an account, I'll need to verify your identity first. Can you please confirm your date of birth and social security number?"
C,Account Verification,Positive,"Sure, my date of birth is January 1st, 1990 and my social security number is 123-45-6789."
A,Problem Resolution,Positive,Thank you. Your account has been successfully created. You will receive an email confirmation shortly.
C,Feedback,Positive,Thank you for your help. Your customer service is excellent.
A,Engagement,Positive,You're welcome! Is there anything else I can help you with?
C,Payment Returns,Negative,"Actually, yes. I need to dispute a charge on my credit card. I didn't make that purchase."
A,Problem Resolution,Positive,I'm sorry to hear that. Let me pull up your account and check the details. Can you please confirm the transaction amount and date?
C,Problem Resolution,Positive,"Yes, it was for $100 on June 1st."
A,Problem Resolution,Positive,Thank you. I'll file a dispute on your behalf and you should see a refund on your account within 7-10 business days.
C,Closure,Positive,"Thank you, that's all for now."
A,Closure,Positive,You're welcome! Have a great day!
A,Greetings,Positive,"Hello and thank you for calling XYZ Bank, my name is Sarah. How may I assist you today?"
C,Problem Resolution,Negative,"Hi Sarah, I'm having trouble accessing my online banking. It keeps saying my password is incorrect even though I know it is right."
A,Problem Resolution,Positive,"I'm sorry to hear that, let me check your account. Can you please verify your account number and date of birth?"
C,Account Verification,Positive,"Sure, my account number is 123456789 and my DOB is 01/01/1990."
A,Problem Resolution,Positive,Thank you. I can see here that your account has been locked. I will reset your password and send a temporary one to your email. Is that okay?
C,Engagement,Positive,"Yes, thank you so much Sarah. I really appreciate your help."
A,Closure,Positive,You're welcome! Is there anything else I can assist you with today?
C,Feedback,Positive,"No, that's all for now. I just wanted to say that your customer service is excellent and I am really satisfied with how you handled my problem."
A,Engagement,Positive,"Thank you so much for your kind words, it means a lot to us. Have a great day!"
C,Closure,Positive,"You too, bye!"
A,Greetings,Positive,"Hello and thank you for calling our bank, how can I assist you today?"
C,Account Verification,Positive,"Yes, hi. I'm trying to access my online banking account but I keep getting an error message."
A,Problem Resolution,Positive,I'm sorry to hear that. Can you please provide me with your account number so we can verify your identity and assist you further?
C,Account Verification,Positive,"Sure, it's 123456789."
A,Problem Resolution,Positive,Thank you for that information. I can see that your account is currently locked due to multiple incorrect login attempts. I will unlock it for you now.
C,Problem Resolution,Positive,"Great, thank you so much!"
A,Engagement,Positive,"No problem, happy to help. Is there anything else I can assist you with today?"
,,,
A,Problem Resolution,Positive,"I'm sorry to hear that. Can you please provide me with more details about the charge, such as the date and amount?"
C,Problem Resolution,Negative,It was for $200 and it was made on June 1st. I have no idea what it's for.
A,Problem Resolution,Positive,I understand your concern. I will open a dispute case for you and we will investigate this charge. You will receive an update within 5-7 business days.
C,Engagement,Positive,"Thank you, that's a relief. You've been very helpful."
A,Closure,Positive,"You're welcome, happy to help. Is there anything else I can assist you with today?"
,,,
A,Closure,Positive,"Thank you for calling our bank, have a great day!"
A,Greetings,Positive,"Thank you for calling XYZ Bank, my name is Alice. How may I assist you today?"
C,Problem Resolution,Negative,"Hi Alice, I recently made a payment but it hasn't been credited to my account yet. Can you check what happened?"
A,Problem Resolution,Positive,"I'm sorry to hear that, may I have your account number please?"
C,Account Verification,Positive,"Sure, my account number is 1234567890."
A,Problem Resolution,Positive,"Thank you, let me check. It seems that the payment was received but not yet processed. I will escalate this to our team to have it resolved immediately."
C,Engagement,Positive,"Thank you, I appreciate your help."
A,Problem Resolution,Positive,You're welcome! Is there anything else that I can help you with today?
C,Complaints,Negative,"Actually, yes. I have been experiencing some issues with your mobile app."
A,Problem Resolution,Positive,I'm sorry to hear that. Can you tell me more about the issues you're having?
C,Feedback,Negative,The app is slow and sometimes it crashes. I also find it difficult to navigate.
A,Problem Resolution,Positive,Thank you for bringing this to our attention. I will forward your feedback to our development team so they can work on improving the app.
C,Engagement,Positive,"Thank you, I hope the app will be better soon."
A,Information Update,Positive,"By the way, have you heard about our new credit card promotion?"
C,Sales,Positive,"No, I haven't. Can you tell me more about it?"
A,Sales,Positive,"Yes, we're offering 0% interest for the first 6 months and a cashback reward for every purchase. Would you like to know more about it?"
C,Sales,Positive,That sounds interesting! Can you send me more information about it?
A,Engagement,Positive,"Sure, I can send you an email with all the details. Can I confirm your email address?"
C,Account Verification,Positive,"Yes, it's john.doe@example.com."
A,Closure,Positive,"Great, I will send the information to your email address. Is there anything else I can help you with today?"
C,Engagement,Positive,"No, that's all. Thank you for your assistance, Alice."
A,Engagement,Positive,"You're welcome, John. Have a great day!"
A,Greetings,Positive,"Good morning, thank you for calling our customer service hotline."
A,Account Verification,Positive,"May I have your account number or debit card number for verification purposes, please?"
,,,
A,Problem Resolution,Negative,I'm sorry to hear that you have an issue. What seems to be the problem?
,,,
A,Problem Resolution,Positive,"Of course, let me check that for you."
A,Problem Resolution,Negative,I see that there was a subscription fee charged to your account. Did you sign up for any subscription service recently?
,,,
A,Problem Resolution,Positive,I will cancel the subscription for you and initiate the refund process. Please allow 3-5 business days for the refund to reflect in your account.
,,,
A,Closure,Positive,You're welcome! Is there anything else I can assist you with today?
,,,
A,Closure,Positive,It was my pleasure assisting you. Have a great day!
A,Greetings,Positive,"Good morning, thank you for calling XYZ Bank. My name is Alex, how may I assist you today?"
C,Sales,Positive,"Hi Alex, I'm interested in opening a new savings account. Can you tell me more about your interest rates and fees?"
A,Information Updates,Positive,"Of course, let me check that for you. Our current interest rate for savings accounts is 0.5% and there are no monthly mainteunkce fees. However, there is a $5 fee for each transaction over the monthly limit of six. Would you like to proceed with opening an account?"
C,Engagement,Positive,"That sounds great, I would like to open an account. What are the next steps?"
A,Account Verification,Positive,"Great, before we proceed, may I have your name and account number please?"
C,Account Verification,Positive,My name is Jane Smith and my account number is 123456789.
A,Problem Resolution,Positive,"Thank you, Jane. I have verified your account and we can proceed with opening a new savings account for you. May I have your email address to send you the necessary documents?"
C,Engagement,Positive,"Sure, my email is jane.smith@gmail.com"
A,Problem Resolution,Positive,"Thank you, Jane. I have sent the necessary documents to your email address. Is there anything else I can assist you with today?"
C,Feedback,Positive,"No, thank you Alex. You were very helpful and made the process very easy."
A,Closure,Positive,"Thank you for choosing XYZ Bank, Jane. Have a great day!"
A,Greetings,Positive,"Thank you for calling XYZ Bank, how may I assist you today?"
C,Account Verification,Positive,"Yes, I need to verify my account please."
A,Account Verification,Positive,"Sure, can you please provide me with your account number or debit card number?"
C,Account Verification,Positive,"Yes, my account number is 123456789."
A,Problem Resolution,Positive,"I can see that your account is active, is there anything else I can help you with today?"
C,Payment Returns,Negative,"Actually, I have an issue with a recent payment I made. It seems to be missing from my account."
A,Problem Resolution,Positive,I'm sorry to hear that. Can you please provide me with the payment details so I can check on it?
C,Payment Returns,Negative,"Yes, the payment was made on June 15th for $200 to account number 987654321."
A,Problem Resolution,Positive,Thank you for the information. Let me just check on that for you.
A,Problem Resolution,Positive,"I can see here that the payment was indeed received, but it was applied to a different account number. I apologize for the confusion."
C,Payment Returns,Negative,That's unacceptable. What can you do to fix it?
A,Problem Resolution,Positive,I understand your frustration. Let me see what I can do to resolve this issue.
A,Problem Resolution,Positive,I have submitted a request to our payment processing team to correct the error and apply the payment to the correct account. You should see the payment reflected in your account within the next 24-48 hours.
C,Problem Resolution,Positive,"Thank you, I appreciate your help with this."
A,Engagement,Positive,You're welcome. Is there anything else I can assist you with today?
C,Feedback,Positive,"No, that's all. I just want to say that I appreciate your prompt and courteous service."
A,Engagement,Positive,Thank you for the kind words. It was my pleasure assisting you today.
C,Closure,Positive,Have a great day!
A,Closure,Positive,You too. Goodbye!
A,Greetings,Positive,"Thank you for calling our bank, how may I assist you today?"
C,Problem Resolution,Negative,I'm calling because I received an overdraft fee on my account and I don't understand why.
A,Problem Resolution,Positive,I'm sorry to hear that. Can you please provide me with your account number so I can look into this for you?
C,Account Verification,Positive,"Sure, it’s 12345678"
A,Problem Resolution,Positive,Thank you. I see that the overdraft fee was applied because your account balance went negative. Did you have any unexpected charges or withdrawals?
C,Problem Resolution,Negative,"No, I don't think so. I just want to know why this happened."
A,Problem Resolution,Positive,"I understand. Sometimes, the fees are applied automatically based on the account balance. However, I can waive the fee for you this time. Is there anything else you need help with?"
C,Problem Resolution,Positive,"No, that's all. Thank you for your help."
A,Closure,Positive,You're welcome. Have a great day!
C,Engagement,Positive,You too!
A,Greetings,Positive,"Thank you for calling our bank, how may I assist you today?"
C,Information Update,Positive,I'd like to know more about your credit card rewards program.
A,Information Update,Positive,"Certainly! Our credit card rewards program offers cashback on each purchase you make, as well as other exclusive benefits like travel rewards and discounts at select merchants."
C,Information Update,Positive,That sounds great. How do I enroll in the program?
A,Account Verification,Positive,"To enroll in the program, I just need to verify your account information. Can you please provide me with your account number or debit card number?"
C,Account Verification,Positive,"Sure, my account number is 98765432."
A,Information Update,Positive,Thank you. I have verified your account and enrolled you in the rewards program. You should start seeing the benefits on your next statement. Is there anything else you need help with?
C,Engagement,Positive,"No, that's all. Thank you for your help."
A,Closure,Positive,You're welcome. Have a great day!
C,Feedback,Positive,I just wanted to say that I really appreciate the great service I've received from your bank.
A,Engagement,Positive,Thank you so much for your kind words! It's always great to hear that we're providing excellent service. Is there anything else you need help with today?
C,Engagement,Positive,"No, that's all. Thank you again!"
A,Closure,Positive,You're welcome. Have a great day!
A,Greetings,Positive,Thank you for calling XYZ Corporation. My name is Alice. How can I assist you today?
C,Sales,Positive,"Hi Alice, I'm interested in purchasing one of your products. Can you tell me more about it?"
A,Product Support,Positive,"Of course! Our product is a smart home security system that includes cameras, sensors, and a mobile app. It's designed to keep you and your family safe and secure. Would you like me to walk you through the features?"
C,Information Updates,Positive,"Yes, please. Have there been any recent updates to the system?"
A,Information Updates,Positive,"Yes, we just released a new version of the mobile app that includes improved user interface and better performance. Have you used our product before?"
C,Account Verification,Positive,"No, I haven’t. But I would like to create an account and make a purchase."
A,Account Verification,Positive,"Great! I can help you with that. To create an account, I will need some information from you. Can you please provide me with your full name and email address?"
C,Account Verification,Positive,Sure. My name is John Smith and my email address is johnsmith@email.com
A,Problem Resolution,Positive,"Thank you, John. I have created an account for you. Is there anything else that I can help you with?"
C,Complaints,Negative,"Actually, I have a complaint. I received a faulty product and I would like to return it."
A,Problem Resolution,Positive,"I'm sorry to hear that, John. Let me check the details of your purchase. Can you please provide me with your order number?"
C,Account Verification,Positive,"Yes, my order number is 123456789."
A,Problem Resolution,Positive,"Thank you, John. I have located your order and I can see that you are eligible for a return. I will send you an email with the return instructions and a prepaid shipping label. Is there anything else that I can help you with?"
C,Feedback,Positive,"No, that's all. Thank you for your help, Alice. You have been very helpful and professional."
A,Closure,Positive,"You're welcome, John. Thank you for choosing XYZ Corporation. If you have any further questions or concerns, don't hesitate to give us a call. Have a great day!"
C,Engagement,Positive,"You too, Alice. Goodbye!"
A,Greetings,Positive,"Good morning and thank you for calling our bank, how may I assist you today?"
C,Product Support,Negative,"I have an issue with my debit card, it keeps getting declined even though I have enough funds."
A,Problem Resolution,Positive,"I'm sorry to hear that, let me check on that for you. Can I have your account number or debit card number please?"
C,Account Verification,Positive,"Sure, it is 123456789."
A,Problem Resolution,Positive,Thank you. It seems like there was a technical issue on our end. I have fixed it and you should be able to use your card now. Is there anything else I can help you with?
C,Feedback,Positive,"Thank you, that was quick and efficient. I appreciate the help."
A,Engagement,Positive,"You're welcome, it's our pleasure to assist you. Is there anything else I can help you with?"
C,Payment Returns,Negative,"Actually, I have another issue. I made a payment to the wrong account, can I get a refund?"
A,Problem Resolution,Positive,I'm sorry to hear that. Let me check on that for you. Can you please provide me with the account number and amount of the payment?
C,Account Verification,Positive,"Sure, the account number is 987654321 and the payment was for $500."
A,Problem Resolution,Positive,Thank you. I have processed the refund and it should appear in your account within 3-5 business days. Is there anything else I can help you with?
C,Engagement,Positive,"No, that's all. Thank you for your help."
A,Closure,Positive,"You're welcome, it was my pleasure to assist you. Have a great day!"
C,Closure,Positive,"You too, bye!"
A,Greetings,Positive,"Hello and welcome to XYZ Bank, my name is Sarah. How may I assist you today?"
C,Account Verification,Positive,"Yes, hi. I'm calling because I need to verify my account information."
A,Account Verification,Positive,Of course. Can you please provide me with your account number or debit card number?
C,Account Verification,Positive,"Sure, my account number is 123456789."
A,Problem Resolution,Positive,Thank you. I have verified your account. Is there anything else I can assist you with today?
C,Complaints,Negative,"Actually, yes. I've noticed some strange charges on my account that I didn't authorize."
A,Problem Resolution,Positive,I'm sorry to hear that. Can you please provide me with more information about the charges?
C,Problem Resolution,Negative,"Yes, there are several charges from a retailer that I've never shopped at before."
A,Problem Resolution,Positive,I understand. Let me take a look at your account and see what's going on.
A,Problem Resolution,Positive,It looks like those charges were made from an online purchase. Have you recently made any online purchases from this retailer?
C,Problem Resolution,Negative,"No, I haven't. I think my account has been compromised."
