Person,Category,Quality,Text
A,Closure,Positive,"You're welcome. Thank you for choosing XYZ Bank, have a great day!"
A,Greetings,Positive,Thank you for calling XYZ Bank. My name is John. How may I assist you today?
C,Complaints,Negative,I have an issue with my account. I received a notification saying my account has been frozen.
A,Problem Resolution,Positive,I'm sorry to hear that. May I know your account number and name so that I can check on it?
C,Account Verification,Positive,"Sure, my account number is 123456789 and my name is Jane Smith."
A,Problem Resolution,Positive,Thank you. Let me check on that. It seems that there was a suspicious transaction on your account. We had to freeze it for your safety. I will send you a link to reset your password and unfreeze your account.
C,Problem Resolution,Positive,"Okay, thank you."
A,Engagement,Positive,Is there anything else I can help you with today?
,,,
A,Product Support,Positive,"Sure, what's your question?"
,,,
A,Product Support,Positive,That feature is available on our app. Let me guide you on how to use it.
C,Product Support,Positive,"Thank you, that was helpful."
A,Engagement,Positive,Is there anything else I can assist you with today?
C,Payment Returns,Negative,"Yes, I need to return a product I purchased using my credit card."
A,Problem Resolution,Positive,I'm sorry to hear that. May I know the reason for the return and the name of the merchant?
C,Payment Returns,Negative,The product is defective and the merchant is XYZ Store.
A,Problem Resolution,Positive,I see. Please give me a moment to process the refund. I will send you an email confirmation once it's done.
C,Problem Resolution,Positive,Thank you.
A,Engagement,Positive,Is there anything else I can assist you with today?
C,Feedback,Positive,"No, that's all. I just wanted to say that I appreciate your help and your excellent customer service."
A,Feedback,Positive,Thank you for your kind words. It was my pleasure to assist you. Have a great day!
C,Closure,Positive,"You too, goodbye!"
A,Greetings,Positive,Hello! Thank you for calling our banking support line. My name is Alex. How may I assist you today?
C,Complaints,Negative,"Yes, hi. I have an issue with my credit card. I was charged incorrectly on my last statement."
A,Problem Resolution,Positive,I'm sorry to hear that. Can I please have your account number so I can look into this for you?
C,Account Verification,Positive,"Sure, it's 123456789."
A,Problem Resolution,Positive,Thank you. I see the issue here. We will issue a credit to your account for the amount charged in error. You should see the adjustment on your next statement.
C,Problem Resolution,Positive,Thank you so much!
A,Engagement,Positive,You're welcome. Is there anything else I can assist you with today?
,,,
A,Closure,Positive,You're welcome! Thank you for choosing our bank. Have a great day!
A,Greetings,Positive,Thank you for calling ABC Bank. How can I assist you today?
C,Account Verification,Positive,"Hi, I need to verify my account information."
A,Account Verification,Positive,Sure. Can you please provide me with your account number?
C,Account Verification,Positive,"Yes, my account number is 123456789."
A,Problem Resolution,Positive,"Great, thank you. Now, what seems to be the problem?"
C,Problem Resolution,Negative,I just noticed that I was charged a fee for not maintaining a minimum balance in my account.
A,Problem Resolution,Positive,I'm sorry to hear that. Let me take a look at your account and see what I can do.
A,Problem Resolution,Positive,"After reviewing your account, I can waive the fee for you this time. Is there anything else I can help you with?"
C,Problem Resolution,Positive,"No, that's all. Thank you for your help."
A,Closure,Positive,You're welcome. Have a great day!
C,Engagement,Positive,"Thank you, you too!"
A,Information Update,Positive,"By the way, we are currently offering a promotion for new customers. Would you be interested in learning more about it?"
C,Sales,Positive,"Yes, I would like to hear more about the promotion."
A,Sales,Positive,"Great! With this promotion, you can get a cash bonus when you open a new checking account with us and meet certain requirements. Would you like to proceed with opening a new account today?"
C,Sales,Positive,"Yes, that sounds good to me. What do I need to do to get started?"
A,Information Update,Positive,"To get started, I just need some basic information from you, such as your name, address, and social security number. I can help you with that now if you're ready."
C,Information Update,Positive,"Yes, I'm ready to get started."
A,Closure,Positive,Great! Thank you for choosing ABC Bank. We appreciate your business.
C,Engagement,Positive,Thank you. I'm excited to get started with my new account!
A,Feedback,Positive,"We love hearing that. If you have any feedback or suggestions for us, please don't hesitate to let us know. We're always looking for ways to improve our services."
C,Feedback,Positive,"Of course, I will definitely keep that in mind. Thank you again for your help!"
A,Greetings,Positive,Thank you for calling XYZ Bank. My name is Alex. May I have your name please?
,,,
A,Account Verification,Positive,"Thank you, Sarah. To verify your account, can you please provide your account number or debit card number?"
C,Account Verification,Positive,"Sure, my account number is 123456789."
A,Problem Resolution,Positive,"Thank you for providing your account information, Sarah. How may I assist you today?"
C,Problem Resolution,Negative,I'm calling because I received a charge on my account that I don't recognize.
A,Problem Resolution,Positive,"I apologize for the inconvenience, Sarah. Let me take a look at your account and see what's going on."
A,Information Update,Positive,It looks like the charge is for a subscription to a streaming service that was signed up for using your account information. Do you recognize this charge?
C,Problem Resolution,Negative,"No, I didn't sign up for any streaming service. Can you help me cancel this subscription and get a refund?"
A,Problem Resolution,Positive,"Absolutely, Sarah. I will cancel the subscription and request a refund for you. Please allow up to 7 business days for the refund to be processed."
C,Feedback,Positive,"Thank you so much for your help, Alex. You were very patient and understanding. I really appreciate it."
A,Engagement,Positive,"You're welcome, Sarah. It was my pleasure to assist you. Is there anything else I can help you with today?"
,,,
A,Closure,Positive,"You are welcome, Sarah. Thank you for choosing XYZ Bank. Have a great day!"
A,Greetings,Positive,Thank you for calling our bank. My name is John. How can I assist you?
C,Problem Resolution,Negative,"Hi John, I have an issue with my bank account. There seems to be some unauthorized charges on my credit card."
A,Problem Resolution,Positive,I'm sorry to hear that. Let me check on your account right away.
A,Account Verification,Positive,Can you please provide me with your account number and the last four digits of your social security number for verification purposes?
C,Account Verification,Positive,"Sure, my account number is 123456789 and the last four digits of my social security number are 1234."
A,Problem Resolution,Positive,Thank you for providing the necessary information. I can see that there are indeed some unauthorized charges on your account. We will take care of this right away and refund the amount back to your account.
C,Problem Resolution,Positive,"Thank you so much, John. I really appreciate your help."
A,Closure,Positive,You are welcome. Is there anything else I can assist you with today?
,,,
A,Closure,Positive,You are welcome. Have a great day!
A,Greetings,Positive,Thank you for calling XYZ Bank. How may I assist you today?
C,Account Verification,Positive,"Yes, I need to verify my account information."
A,Problem Resolution,Positive,"Sure, could you please provide me with your account number?"
C,Problem Resolution,Positive,"Sure, it is 123456789."
A,Problem Resolution,Positive,"Great, thank you for that. Can you please tell me what issue you are experiencing?"
C,Problem Resolution,Negative,I noticed some fraudulent charges on my account that I did not make.
A,Problem Resolution,Positive,I'm sorry to hear that. I'll go ahead and file a dispute for those charges and have them removed from your account. We'll also send you a new card to ensure your account security.
C,Problem Resolution,Positive,"Thank you, I appreciate that."
A,Engagement,Positive,Is there anything else I can assist you with today?
,,,
A,Closure,Positive,You're welcome. Thank you for choosing XYZ Bank.
A,Greetings,Positive,"Welcome to XYZ Bank, how may I assist you today?"
C,Complaints,Negative,"I received a notification that my account has been charged a fee, but I don't know what it's for."
A,Problem Resolution,Positive,"I apologize for the inconvenience, let me check your account and see what the fee is for."
A,Account Verification,Positive,May I have your account number or debit card number to verify your account?
C,Account Verification,Positive,"Sure, my account number is 123456789."
A,Problem Resolution,Positive,Thank you for that. I see that the fee was charged for a late payment on your credit card bill.
C,Complaints,Negative,But I never received a bill or any notification about it.
A,Problem Resolution,Positive,I apologize for the inconvenience. Let me waive the fee for you and make sure you receive your bills and notifications going forward.
C,Problem Resolution,Positive,"Thank you so much, I really appreciate it."
A,Engagement,Positive,Is there anything else I can help you with today?
,,,
A,Information Update,Positive,"Sure, what product are you referring to?"
,,,
A,Information Update,Positive,"Yes, that's our latest credit card product with 2% cashback on all purchases."
,,,
A,Information Update,Positive,"Sure, to be eligible for the card, you need to have a credit score above 700 and a minimum annual income of $50,000."
C,Engagement,Positive,"Thank you for the information, I'll definitely consider applying for it."
A,Engagement,Positive,You're welcome. Is there anything else I can help you with?
C,Feedback,Positive,"No, that's all for now. I just want to say that I'm really happy with the service I received today."
A,Engagement,Positive,"Thank you for your kind words, it was my pleasure to assist you today. Have a great day!"
C,Closure,Positive,You too!
A,Greetings,Positive,"Good morning, thank you for calling XYZ Bank. This is Jane, how can I assist you today?"
C,Problem Resolution,Negative,"Hi Jane, I have an issue with my account. I made a payment last week but it hasn't been reflected yet."
A,Problem Resolution,Positive,I'm sorry to hear that. Can you please provide me with your account number so I can check on it?
C,Account Verification,Positive,"Sure, it's 123456789."
A,Problem Resolution,Positive,"Thank you. I can see here that the payment was received, but there was a delay in processing it. I will escalate this to our technical team and make sure that the payment is posted within the next 24 hours. Is there anything else I can help you with?"
C,Engagement,Positive,"Thank you, Jane. That's all for now."
A,Closure,Positive,"You're welcome. Thank you for calling XYZ Bank, have a great day!"
A,Greetings,Positive,"Thank you for calling XYZ Bank, my name is Alex. How can I assist you today?"
C,Payment Returns,Negative,"Hi Alex, I recently made a payment but it seems like it was processed twice. Can you help me with this?"
A,Problem Resolution,Positive,"I apologize for the inconvenience, let me check that for you. May I have the transaction ID and the date of the payment?"
C,Account Verification,Positive,"Sure, the transaction ID is 12345 and the payment was made on June 30th."
A,Problem Resolution,Positive,Thank you. I can see that the payment was processed twice. I will initiate a refund for the extra amount and it should reflect in your account within 3-5 business days.
C,Problem Resolution,Positive,"Great, thank you for your help."
A,Feedback,Positive,Is there anything else I can assist you with today?
C,Sales,Positive,"Actually, I was interested in the credit card options that you offer. Can you give me some details?"
A,Information Updates,Positive,"Of course, we have a variety of credit cards to choose from with different rewards and benefits. Let me pull up some information for you."
A,Information Updates,Positive,Our most popular card is the XYZ Rewards card which offers 2% cash back on all purchases. We also have a travel rewards card and a low-interest rate card.
C,Sales,Positive,That sounds great. Can you tell me the eligibility criteria for these cards?
A,Information Updates,Positive,"Sure, the eligibility criteria varies based on the card you choose. Generally, you need to have a good credit score and a steady income to be eligible."
C,Sales,Positive,"Okay, I will look into it. Thanks for the information."
A,Engagement,Positive,You're welcome. Is there anything else I can assist you with today?
C,Complaints,Negative,"Actually, I have a complaint. I have been trying to reach your customer service for the past hour but have not been able to get through."
A,Problem Resolution,Positive,I'm sorry to hear that. Our customer service lines are experiencing higher than usual call volumes. Let me see if I can assist you with your issue.
C,Complaints,Negative,"I have been charged an annual fee for my credit card, but I was not aware of this when I signed up. This is unacceptable."
A,Problem Resolution,Positive,I apologize for the confusion. Let me check your account and see what can be done about this.
A,Problem Resolution,Positive,"I have reviewed your account and it looks like you signed up for a rewards credit card which has an annual fee. However, I can waive the fee for this year as a one-time courtesy. Would you like me to do that for you?"
C,Problem Resolution,Positive,"Yes, please. Thank you for your help."
A,Closure,Positive,"Alright, I have waived the fee for you. Is there anything else I can assist you with today?"
C,Engagement,Positive,"No, that's all. Thank you for your help."
A,Closure,Positive,You're welcome. Have a great day!
A,Greetings,Positive,"Good morning! Thank you for calling our bank. My name is Sarah, how may I assist you today?"
C,Problem Resolution,Negative,"Hi Sarah, I'm calling because I received a notification that my account is overdrawn. I don't understand why."
A,Problem Resolution,Positive,I'm sorry to hear that. Can I have your account number or debit card number so that I can take a look at your account?
C,Account Verification,Positive,"Sure, my account number is 1234567890."
A,Problem Resolution,Positive,"Thank you. Upon checking, it seems that there was an error in our system that caused the overdraft notification. Your account is actually in good standing. I apologize for the confusion."
C,Engagement,Positive,"Oh, that's a relief. Thank you for resolving the issue so quickly, Sarah."
A,Closure,Positive,You're welcome! Is there anything else I can help you with today?
C,Feedback,Positive,"No, that's all. I just wanted to say that I really appreciate the excellent customer service."
A,Engagement,Positive,Thank you for your kind words. We strive to provide the best service possible. Have a great day!
A,Greetings,Positive,Good afternoon! Thank you for calling our customer service hotline. How may I assist you today?
C,Complaints,Negative,"Yes, I have a complaint about a product I recently purchased from your website."
A,Problem Resolution,Positive,I'm sorry to hear that. Can you please provide me with your order number so I can look into the issue?
,,,
A,Problem Resolution,Positive,Thank you. I can see that you purchased a faulty product. We can either offer you a refund or a replacement. Which one would you prefer?
C,Problem Resolution,Positive,"I would like a replacement, please."
A,Problem Resolution,Positive,"Alright, I have processed the replacement request for you. You should receive it within 5-7 business days. Is there anything else I can assist you with?"
,,,
A,Closure,Positive,You're welcome! Thank you for choosing our brand. Have a great day!
C,Closure,Positive,"You too, goodbye!"
A,Greetings,Positive,Hello and welcome to XYZ Bank. How can I assist you today?
C,Problem Resolution,Negative,"Hi, I received a notification that my account is overdrawn. Can you explain why?"
A,Problem Resolution,Positive,I'm sorry to hear that. Can you please provide me with your account number so I can look into this?
C,Account Verification,Positive,"Sure, my account number is 123456."
A,Problem Resolution,Positive,Thank you. It looks like you had several transactions that caused your account to go negative. Would you like to set up overdraft protection to avoid this in the future?
C,Engagement,Negative,"No, I don't want to pay extra fees for that."
A,Problem Resolution,Positive,"Okay, I understand. Is there anything else I can assist you with today?"
C,Complaints,Negative,"Yes, I'm also not happy with the interest rate on my savings account. It's too low."
A,Product Support,Positive,I'm sorry to hear that. We do have some other savings accounts with higher interest rates. Would you like me to provide you with more information on those?
C,Engagement,Positive,"Yes, please."
A,Information Updates,Positive,Great. We have a new savings account that offers a higher interest rate. It requires a minimum deposit of $1000 and a monthly direct deposit of at least $500. Would you like to open this account?
C,Engagement,Positive,"Yes, that sounds like a good option. How do I get started?"
A,Engagement,Positive,"I can help you open the account right now. Can you please provide me with your personal information, such as your name, address, and social security number?"
C,Account Verification,Positive,"Sure, my name is John Smith, my address is 123 Main St, and my social security number is 123-45-6789."
A,Problem Resolution,Positive,"Thank you, John. Your new savings account has been opened. You should see the deposit reflected in your account within 24-48 hours. Is there anything else I can assist you with today?"
C,Feedback,Positive,"No, that's all. Thank you for your help. You made the process very easy."
A,Closure,Positive,"You're welcome, John. It was my pleasure to assist you. Have a great day!"
C,Closure,Positive,You too!
A,Greetings,Positive,"Hello, thank you for calling our company. My name is John, how may I assist you today?"
C,Sales,Positive,"Hi John, I'm interested in purchasing a new product from your company. Can you tell me more about it?"
A,Product Support,Positive,"Of course! Our new product is a high-performance laptop with advanced features such as a long-lasting battery, fast processing speed, and an HD display. Is there any particular feature you would like to know more about?"
C,Engagement,Positive,"That sounds great, John! I'm very interested in this laptop. How can I buy it?"
A,Account Verification,Positive,"To place an order, I just need to verify some information first. Can you please provide your account number or debit card number?"
C,Account Verification,Positive,"Sure, my account number is 1234567890."
A,Problem Resolution,Positive,"Thank you, I have verified your account. I see that you have a discount code that you can use for this purchase. Let me apply that for you."
C,Feedback,Positive,"Thank you, John! I really appreciate your help. Your customer service is excellent!"
A,Closure,Positive,You're welcome! I'm glad that I could assist you. Is there anything else I can help you with today?
,,,
A,Closure,Positive,You're welcome! Have a great day!
A,Greetings,Positive,"Good morning! Thank you for calling XYZ Bank, my name is Sarah. How may I assist you today?"
C,Account Verification,Positive,"Hi Sarah, my name is John and I need to verify my account for a transaction."
A,Account Verification,Positive,"Certainly, John. Could you please provide me with your account number or debit card number?"
C,Account Verification,Positive,"Sure, it's 123456789."
A,Problem Resolution,Positive,"Thank you, John. I have verified your account and you're all set for your transaction. Is there anything else I can help you with?"
C,Payment Returns,Negative,"Actually, I have an issue with a payment that was returned to my account. Can you help me with that?"
A,Problem Resolution,Positive,"Of course, John. Can you please provide me with the details of the transaction and the reason for the return?"
C,Problem Resolution,Negative,"I'm not sure about the reason, but the transaction was for $500 and it was returned to my account without any explanation."
A,Problem Resolution,Positive,"I'm sorry to hear that, John. Let me check your account and the transaction details to see what happened. Please bear with me for a moment."
A,Problem Resolution,Positive,"Thank you for your patience, John. It seems that the payment was returned due to insufficient funds in the sender's account. I can help you initiate the payment again if you would like."
C,Problem Resolution,Positive,"Yes, please. That would be great."
A,Problem Resolution,Positive,"Alright, John. I have initiated the payment again and you should receive it within 2-3 business days. Is there anything else I can help you with?"
C,Feedback,Positive,"No, that's all. Thank you for your help, Sarah. You were very patient and understanding."
A,Closure,Positive,"You're welcome, John. Thank you for choosing XYZ Bank. Have a great day!"
C,Closure,Positive,"You too, Sarah."
A,Greetings,Positive,Welcome to ABC Corporation. This is Sarah speaking. How may I help you today?
C,Sales,Positive,"Hi Sarah, I'm interested in purchasing a new laptop. Can you tell me more about your products?"
A,Information Update,Positive,"Certainly! We have a variety of laptops available, ranging from basic models to high-performance gaming laptops. Are you looking for something specific?"
C,Sales,Positive,I'm looking for a laptop with good battery life and a decent graphics card for video editing.
A,Product Support,Positive,"I would recommend our new model, the XYZ laptop. It has a long battery life and a dedicated graphics card that can handle video editing software. Would you like me to walk you through the specs?"
C,Engagement,Positive,"Yes, please!"
A,Product Support,Positive,"The XYZ laptop has a 15.6 inch Full HD display, an Intel Core i7 processor, 16GB of RAM, and a 512GB SSD. It also has a NVIDIA GeForce GTX 1650 graphics card, which is perfect for video editing. Does that sound good to you?"
C,Sales,Positive,"Yes, that sounds great! How much does it cost?"
A,Sales,Positive,"The XYZ laptop is currently on sale for $999, which is 20% off the original price. Would you like to place an order?"
C,Payment Returns,Negative,"Actually, I already purchased a laptop from your company last week, but it arrived damaged. Can I get a refund or replacement?"
A,Problem Resolution,Positive,I'm sorry to hear that. Can you please provide me with your order number so I can look into this for you?
C,Account Verification,Positive,"Sure, my order number is 12345."
A,Problem Resolution,Positive,Thank you. I can see your order details now. We can either issue you a refund or send you a replacement laptop. Which would you prefer?
C,Engagement,Positive,I would prefer a replacement laptop.
A,Problem Resolution,Positive,Understood. I have processed a replacement order for you. It should arrive within 3 business days. Is there anything else I can assist you with today?
C,Feedback,Positive,"No, that's all. Thank you for your help, Sarah. You've been very helpful."
A,Closure,Positive,You're welcome! Thank you for choosing ABC Corporation. Have a great day!
A,Greetings,Positive,"Thank you for calling ABC Bank. This is Emily, how can I assist you today?"
C,Product Support,Negative,"Hi Emily, I'm having trouble accessing my online banking. It keeps giving me an error message."
A,Problem Resolution,Positive,I'm sorry to hear that. Let me check your account and see what the issue might be.
C,Account Verification,Positive,"Sure, my account number is 123456789."
A,Problem Resolution,Positive,"Thank you. It looks like there was a temporary glitch in the system, but it should be working now. Can you try logging in again and let me know if you still have issues?"
C,Problem Resolution,Positive,"Okay, I'll try that. Thanks for your help."
A,Engagement,Positive,You're welcome! Is there anything else I can assist you with today?
C,Sales,Positive,"Actually, yes. I'm interested in applying for a credit card. Can you tell me more about the options available?"
A,Product Support,Positive,"Of course! We have a few different options to choose from, depending on your needs. Would you like me to go over the details?"
C,Information Update,Positive,"Yes, please. I'm particularly interested in the rewards programs."
A,Product Support,Positive,"Great. We have a cash back card that earns 1% cash back on all purchases, and a points card that earns 1 point per dollar spent, redeemable for travel, merchandise, and more. Which one would you be interested in?"
C,Sales,Positive,I think I'd like to apply for the cash back card.
A,Account Verification,Positive,"Okay, let me just verify a few details. Can you confirm your mailing address for me?"
C,Account Verification,Positive,"Sure, it's 123 Main St."
A,Product Support,Positive,Great. I'll just need to ask you a few more questions to complete the application process. Are you ready to get started?
C,Engagement,Positive,"Yes, let's do it!"
A,Closure,Positive,Fantastic. Thank you for choosing ABC Bank. You should receive a decision on your application within the next few days.
C,Closure,Positive,"Thank you, Emily. I appreciate all your help today. You've been great!"
